title,link,date
Getting Acquainted With A Production Code Base,/blog/getting-up-to-speed-on-a-production-code-base,6/18/2019
"Staff Spotlight - Zach DeRossette, Career Coach",/blog/staff-spotlight-zach-derossette,5/22/2019
Student Interview: Lena Ryoo on Company Projects,/blog/student-interview-lena-ryoo,5/15/2019
Debugging Like a Scientist,/blog/debugging-like-a-scientist,4/29/2019
The Benefits of Code Reviews,/blog/benefits-of-code-reviews,3/29/2019
Three More JavaScript Mistakes That Beginners Make,/blog/three-more-js-mistakes-that-beginners-make,3/7/2019
Alumni Spotlight: Miranda Howitt,/blog/alumni-spotlight-miranda,2/12/2019
Alumni Spotlight: Kristen Lingwood,/blog/alumni-spotlight-kristen,2/6/2019
Alumni Spotlight: Tyler Ketron,/blog/alumni-spotlight-tyler,1/30/2019
Avoiding Burnout,/blog/avoiding-burnout,1/9/2019
Student Interview: Sarah + Zac on Company Projects,/blog/student-interview-sarah-zac,12/18/2018
A New Tuition Option: We Make Money Only When You Do,/blog/new-tuition-option,12/11/2018
MongoDB is Easy,/blog/mongodb-is-easy,12/6/2018
Meet The Instructor: Alissa Renz,/blog/meet-the-instructor-alissa-renz,11/14/2018
Error Handling in Express,/blog/error-handling-express,11/5/2018
Four Tips for Moving Faster as a Developer,/blog/developer-productivity,10/16/2018
Five Tips to Manage the Emotional Side of a Coding Program,/blog/five-tips-emotional-management,10/8/2018
Does Emotional Intelligence Get You Paid More in Tech?,/blog/emotional-intelligence,10/3/2018
Post-Outcomes Blog: Top 3 Insights for Job-Seekers,/blog/insights-job-seekers,9/27/2018
"Staff Spotlight - Megan Lane, Operations & Events Associate",/blog/staff-spotlight-megan-lane,9/11/2018
Different Approaches to Using Relational Databases with Express,/blog/different-approaches-express,8/28/2018
The Job Funnel,/blog/the-job-funnel,8/20/2018
Alumni Spotlight: Daniel Szabo,/blog/alumni-spotlight-daniel,8/8/2018
Rithm School Interview FAQs,/blog/rithm-interview-faqs,8/1/2018
BPPE Approval and Outcomes Numbers,/blog/bppe-approval-and-outcomes-numbers,7/25/2018
What’s New in Python 3.7: Data Classes,/blog/whats-new-in-python-3-7,7/11/2018
Five Tips for Getting Yourself Unstuck,/blog/five-tips-for-getting-yourself-unstuck,6/22/2018
A Roadmap for Learning How To Code - Part 3,/blog/roadmap-for-learning-how-to-code-03,6/13/2018
Student Interview: Paula + Miranda on Company Projects,/blog/student-interview-paula-miranda,6/5/2018
Five Essential Rules when Job Searching,/blog/five-essential-rules-when-job-searching,5/31/2018
Outcomes: A Preview,/blog/outcomes-a-preview,5/22/2018
The Benefit of Low-Abstraction Frameworks for Scaffolding Learning,/blog/low-abstraction-frameworks,5/16/2018
Are Coding Schools Worth the Cost?,/blog/are-coding-schools-worth-the-cost,4/25/2018
A Roadmap for Learning How To Code - Part 2,/blog/roadmap-for-learning-how-to-code-02,4/10/2018
Meet The Instructor: Joel Burton,/blog/meet-the-instructor-joel-burton,3/27/2018
Alumni Spotlight: Anna-Brit Schlaepfer,/blog/alumni-spotlight-anna-brit,3/19/2018
The Art of Outreach,/blog/the-art-of-outreach,2/28/2018
Intro to VS Code,/blog/vscode,2/20/2018
Debugging Like a Developer,/blog/debugging-like-a-developer,2/6/2018
Student Interview: Allie + Stephen on Company Projects,/blog/student-interview-allie-stephen,1/31/2018
A Roadmap for Learning How To Code - Part 1,/blog/roadmap-for-learning-how-to-code-01,1/24/2018
Computer Science Degree vs. Coding Bootcamp Tradeoffs,/blog/computer-science-vs-coding-bootcamp,1/10/2018
New Year's Resolutions: Developer Edition,/blog/new-years-resolutions,1/2/2018
Student Spotlight: Sean Mangosing,/blog/student-spotlight-sean-mangosing,12/20/2017
"New Year, New Outcomes",/blog/new-year-new-outcomes,12/11/2017
Five Tips for Landing a Job as a Bootcamp Grad,/blog/five-tips-for-landing-a-job,12/5/2017
"Our Newest Scholarship, Diversity, and How Rithm Supports Your Coding Education",/blog/our-newest-scholarship,11/28/2017
Why Pay For School?,/blog/why-pay-for-school,11/21/2017
"This Holiday Season, Give Back to Tech for Good",/blog/this-holiday-season-give-back-to-tech-for-good,11/7/2017
Meet The Instructor: Michael Hueter,/blog/meet-the-instructor-michael-hueter,10/24/2017
Student Spotlight: Adele Landers,/blog/student-spotlight-adele-landers,10/17/2017
Do Web Developers Need to be Good at Math?,/blog/do-web-developers-need-to-be-good-at-math,10/10/2017
Top 4 JavaScript Mistakes That Beginners Make,/blog/top-four-js-mistakes-that-beginners-make,9/27/2017
Interview With An Alumni: Katie Krieger,/blog/interview-with-an-alumni-katie-krieger,9/19/2017
What Makes a Successful Student?,/blog/what-makes-a-successful-student,9/5/2017
5 Topics To Master Before Learning React,/blog/5-topics-to-master-before-learning-react,8/29/2017
Soft Skills That Actually Matter In Tech,/blog/soft-skills-that-actually-matter-in-tech,8/22/2017
What I Wish Someone Had Told Me Before I Learned To Code,/blog/what-i-wish-someone-had-told-me-before-i-learned-to-code,8/15/2017
Rithm School Scholarship Winner Interview: Michelle Huynh,/blog/diversity-scholarship-winner-interview-michelle-huynh,8/8/2017
A Bootcamp Bubble?,/blog/a-bootcamp-bubble,8/1/2017
Student Interview: Julia Hazer on Company Projects,/blog/student-interview-julia-hazer,7/18/2017
Five Tips to Get Into Rithm,/blog/five-tips-to-get-into-rithm,7/11/2017
Problem Solving Strategies: Look Back and Refactor,/blog/problem-solving-strategies-06,6/27/2017
Student Interview: Shriya Nevatia,/blog/student-interview-shriya-nevatia,6/19/2017
"Scholarships, Diversity and How Rithm Supports Your Coding Education",/blog/scholarships-diversity-education,5/23/2017
Demystifying Deep Learning,/blog/demystifying-deep-learning,5/11/2017
"Staff Spotlight: Angelina Davis, Admissions Manager",/blog/staff-spotlight-angelina-davis,5/2/2017
Student Interview: Torre Taylor on Company Projects,/blog/student-interview-torre-taylor,4/18/2017
Becoming a Self-Reliant Developer,/blog/becoming-a-self-reliant-developer,4/6/2017
You Should Be Going To Tech Conferences,/blog/you-should-be-going-to-tech-conferences,3/30/2017
Student Interview: Andrew Mundy,/blog/student-interview-andrew-mundy,3/23/2017
She’s Been Persisting: 6 Women in Tech Organizations You Should Know About,/blog/shes-been-persisting,3/16/2017
Bootcamp Curious? Perspective from a Recovering Academic,/blog/bootcamp-curious-perspective-from-a-recovering-academic,3/9/2017
Problem Solving Strategies: Use Tools Strategically,/blog/problem-solving-strategies-05,2/2/2017
Problem Solving Strategies: Solve a Simpler Problem,/blog/problem-solving-strategies-04,1/19/2017
Your Roadmap to Learning JavaScript,/blog/your-roadmap-to-learning-javascript,1/5/2017
What A Small Class Size Meant to Me,/blog/what-a-small-class-size-meant-to-me,12/19/2016
Student Interview: Greg,/blog/student-interview-greg,12/19/2016
How to Prepare for the Rithm Technical Interview,/blog/how-to-prepare-for-the-rithm-technical-interview,12/8/2016
Problem Solving Strategies: Break It Down,/blog/problem-solving-strategies-03,12/5/2016
Problem Solving Strategies: Explore Concrete Examples,/blog/problem-solving-strategies-02,11/28/2016
Problem Solving Strategies: Understand the Problem,/blog/problem-solving-strategies-01,11/21/2016
Why Do You Want To Code?,/blog/why-do-you-want-to-code,11/15/2016
Essential Tools for Web Development,/blog/essential-tools-for-web-development,10/21/2016
Five Reasons to Learn JavaScript,/blog/five-reasons-to-learn-javascript,9/29/2016
Free Course Prep,/blog/free-course-prep,9/20/2016
Building Better Job Support,/blog/building-better-job-support,9/14/2016
Why Another Bootcamp?,/blog/why-another-bootcamp,9/6/2016
